{
  "case_id": "04-zh-retail-analysis",
  "evaluations": [
    {
      "label": "A",
      "naturalness": 3,
      "reader_clarity": 5,
      "register_fit": 4,
      "claims": [
        {
          "id": "C1",
          "status": "intact",
          "evidence": "星河零售于 2026 年 4 月在 12 家门店启动试点"
        },
        {
          "id": "C2",
          "status": "intact",
          "evidence": "顾客平均等待时间从 4 分钟缩短至 45 秒"
        },
        {
          "id": "C3",
          "status": "intact",
          "evidence": "转人工比例从 31% 降至 18%"
        },
        {
          "id": "C4",
          "status": "intact",
          "evidence": "满意度则保持在 4.2/5，与上一季度持平"
        },
        {
          "id": "C5",
          "status": "intact",
          "evidence": "自动回答常见问题、接入订单查询系统，以及为售后问题添加标签"
        },
        {
          "id": "C6",
          "status": "intact",
          "evidence": "员工可以少做重复劳动，把更多精力放在需要沟通和判断的服务上"
        },
        {
          "id": "C7",
          "status": "intact",
          "evidence": "方言识别和复杂退款仍是主要挑战"
        },
        {
          "id": "C8",
          "status": "intact",
          "evidence": "公司计划先完成隐私评估，再于 Q4 将系统扩大到 40 家门店"
        }
      ],
      "added_claims": [],
      "rationale": "Preserves all facts, judgments, and information from the source, including the industry context. Successfully removes AI buzzwords, but the phrasing remains somewhat mechanical and translation-like (e.g., '正被企业用于')."
    },
    {
      "label": "B",
      "naturalness": 4,
      "reader_clarity": 5,
      "register_fit": 4,
      "claims": [
        {
          "id": "C1",
          "status": "intact",
          "evidence": "星河零售于 2026 年 4 月在 12 家门店启动 AI 客服试点。"
        },
        {
          "id": "C2",
          "status": "intact",
          "evidence": "顾客平均等待时间从 4 分钟降至 45 秒"
        },
        {
          "id": "C3",
          "status": "intact",
          "evidence": "转人工比例从 31% 降至 18%"
        },
        {
          "id": "C4",
          "status": "intact",
          "evidence": "满意度为 4.2/5，与上一季度持平"
        },
        {
          "id": "C5",
          "status": "intact",
          "evidence": "回答常见问题、接入订单查询系统，以及为售后问题添加标签"
        },
        {
          "id": "C6",
          "status": "intact",
          "evidence": "分担重复性事务，让员工把时间留给更需要沟通的工作"
        },
        {
          "id": "C7",
          "status": "intact",
          "evidence": "方言识别和复杂退款仍是试点中的主要难点"
        },
        {
          "id": "C8",
          "status": "intact",
          "evidence": "公司计划先完成隐私评估，再于第四季度将系统扩展到 40 家门店"
        }
      ],
      "added_claims": [],
      "rationale": "Concise and clear, but drops both the opening industry context and the strategic meaning of the pilot, resulting in a significant loss of information. All claims from the inventory are intact."
    },
    {
      "label": "C",
      "naturalness": 4,
      "reader_clarity": 5,
      "register_fit": 4,
      "claims": [
        {
          "id": "C1",
          "status": "intact",
          "evidence": "星河零售于 2026 年 4 月在 12 家门店启动 AI 客服试点"
        },
        {
          "id": "C2",
          "status": "intact",
          "evidence": "顾客平均等待时间由 4 分钟缩短至 45 秒"
        },
        {
          "id": "C3",
          "status": "intact",
          "evidence": "转人工比例由 31% 降至 18%"
        },
        {
          "id": "C4",
          "status": "intact",
          "evidence": "满意度则维持在 4.2/5，与上一季度持平"
        },
        {
          "id": "C5",
          "status": "intact",
          "evidence": "回答常见问题、接入订单查询系统，以及为售后问题添加标签"
        },
        {
          "id": "C6",
          "status": "intact",
          "evidence": "并非单纯用机器替代人工，而是减少员工在重复性事务上的投入，让他们把更多精力放在需要沟通和判断的服务环节上"
        },
        {
          "id": "C7",
          "status": "intact",
          "evidence": "方言识别和复杂退款仍是主要挑战"
        },
        {
          "id": "C8",
          "status": "altered",
          "evidence": "公司计划先完成隐私评估，并于 Q4 将系统扩展至 40 家门店"
        }
      ],
      "added_claims": [
        {
          "claim": "The pilot was launched to observe its impact on customer experience and frontline service work.",
          "evidence": "重点观察其对顾客体验和一线服务工作的影响。"
        }
      ],
      "rationale": "Drops the industry context and strategic meaning, failing to preserve all information. It alters the strict conditionality of the expansion plan by using '并于' instead of '再于', and adds an unstated purpose for the pilot."
    },
    {
      "label": "D",
      "naturalness": 5,
      "reader_clarity": 5,
      "register_fit": 5,
      "claims": [
        {
          "id": "C1",
          "status": "intact",
          "evidence": "星河零售已在 12 家门店启动 AI 客服试点。试点始于 2026 年 4 月"
        },
        {
          "id": "C2",
          "status": "intact",
          "evidence": "顾客平均等待时间由 4 分钟降至 45 秒"
        },
        {
          "id": "C3",
          "status": "intact",
          "evidence": "转人工比例从 31% 降到 18%"
        },
        {
          "id": "C4",
          "status": "intact",
          "evidence": "满意度仍为 4.2/5，与上一季度持平"
        },
        {
          "id": "C5",
          "status": "intact",
          "evidence": "回答常见问题、接入订单查询系统、给售后问题加标签"
        },
        {
          "id": "C6",
          "status": "intact",
          "evidence": "并不是把人工客服整体替换掉，而是把员工从重复咨询中解放出来，转去处理更需要沟通和判断的问题"
        },
        {
          "id": "C7",
          "status": "intact",
          "evidence": "方言识别和复杂退款仍是眼下的主要难点"
        },
        {
          "id": "C8",
          "status": "intact",
          "evidence": "公司计划先完成隐私评估，再于 Q4 把系统扩展到 40 家门店"
        }
      ],
      "added_claims": [],
      "rationale": "Features very natural and engaging prose that successfully removes AI flavor. However, it drops the opening industry context entirely, failing the instruction to preserve all information."
    },
    {
      "label": "E",
      "naturalness": 4,
      "reader_clarity": 5,
      "register_fit": 5,
      "claims": [
        {
          "id": "C1",
          "status": "intact",
          "evidence": "星河零售于 2026 年 4 月在 12 家门店启动试点"
        },
        {
          "id": "C2",
          "status": "intact",
          "evidence": "顾客平均等待时间从 4 分钟缩短至 45 秒"
        },
        {
          "id": "C3",
          "status": "intact",
          "evidence": "转人工比例从 31% 降至 18%"
        },
        {
          "id": "C4",
          "status": "intact",
          "evidence": "满意度则保持在 4.2/5，与上一季度持平"
        },
        {
          "id": "C5",
          "status": "intact",
          "evidence": "回答常见问题、连接订单查询系统，以及为售后问题添加标签"
        },
        {
          "id": "C6",
          "status": "intact",
          "evidence": "并非简单替代人工，而是减少员工在重复事务上耗费的时间，让他们把精力放到更需要沟通和判断的服务环节"
        },
        {
          "id": "C7",
          "status": "intact",
          "evidence": "方言识别和复杂退款仍是主要挑战"
        },
        {
          "id": "C8",
          "status": "intact",
          "evidence": "星河零售计划先完成隐私评估，再于 Q4 将系统扩大到 40 家门店"
        }
      ],
      "added_claims": [],
      "rationale": "Preserves all information and removes AI flavor effectively. The phrasing is natural, clear, and fits the business register well, though slightly more conventional than the best output."
    },
    {
      "label": "F",
      "naturalness": 5,
      "reader_clarity": 5,
      "register_fit": 5,
      "claims": [
        {
          "id": "C1",
          "status": "intact",
          "evidence": "星河零售于 2026 年 4 月在 12 家门店启动试点"
        },
        {
          "id": "C2",
          "status": "intact",
          "evidence": "顾客平均等待时间从 4 分钟缩短到 45 秒"
        },
        {
          "id": "C3",
          "status": "intact",
          "evidence": "转人工比例从 31% 降至 18%"
        },
        {
          "id": "C4",
          "status": "intact",
          "evidence": "满意度仍保持在 4.2/5，与上一季度持平"
        },
        {
          "id": "C5",
          "status": "intact",
          "evidence": "回答常见问题，接入订单查询系统，为售后问题添加标签"
        },
        {
          "id": "C6",
          "status": "intact",
          "evidence": "它承担的是标准化、重复性的部分，员工则可以少花时间处理这些事务，把精力留给更复杂、也更需要沟通温度的服务"
        },
        {
          "id": "C7",
          "status": "intact",
          "evidence": "方言识别和复杂退款，仍是目前最主要的挑战"
        },
        {
          "id": "C8",
          "status": "intact",
          "evidence": "公司计划先完成隐私评估，再在第四季度将系统扩展到 40 家门店"
        }
      ],
      "added_claims": [],
      "rationale": "Perfectly preserves all facts, judgments, and information. Masterfully removes AI buzzwords and replaces them with highly natural, mature business prose (e.g., '寻找增长空间', '沟通温度')."
    }
  ],
  "ranking": [
    "F",
    "E",
    "A",
    "D",
    "B",
    "C"
  ],
  "best": "F",
  "confidence": "high",
  "limitations": "None"
}
