{
  "case_id": "04-zh-retail-analysis",
  "evaluations": [
    {
      "label": "A",
      "naturalness": 5,
      "reader_clarity": 5,
      "register_fit": 5,
      "claims": [
        {
          "id": "C1",
          "status": "intact",
          "evidence": "“星河零售于 2026 年 4 月在 12 家门店启动试点”"
        },
        {
          "id": "C2",
          "status": "intact",
          "evidence": "“顾客平均等待时间从 4 分钟缩短至 45 秒”"
        },
        {
          "id": "C3",
          "status": "intact",
          "evidence": "“转人工比例从 31% 降至 18%”"
        },
        {
          "id": "C4",
          "status": "intact",
          "evidence": "“满意度则保持在 4.2/5，与上一季度持平”"
        },
        {
          "id": "C5",
          "status": "intact",
          "evidence": "“自动回答常见问题、接入订单查询系统，以及为售后问题添加标签”"
        },
        {
          "id": "C6",
          "status": "intact",
          "evidence": "“员工可以少做重复劳动，把更多精力放在需要沟通和判断的服务上”"
        },
        {
          "id": "C7",
          "status": "intact",
          "evidence": "“方言识别和复杂退款仍是主要挑战”"
        },
        {
          "id": "C8",
          "status": "intact",
          "evidence": "“公司计划先完成隐私评估，再于 Q4 将系统扩大到 40 家门店”"
        }
      ],
      "added_claims": [
        {
          "claim": "需要员工接手的服务还需要更多判断。",
          "evidence": "“把更多精力放在需要沟通和判断的服务上”"
        }
      ],
      "rationale": "表达简洁自然，全部清单事实均得到保留，战略意义和智能化起点等原文判断也基本完整。主要偏差是用“需要判断”替换了原文“更具温度和价值”的表述，并未明确复述“不是简单替代人工”。"
    },
    {
      "label": "B",
      "naturalness": 5,
      "reader_clarity": 5,
      "register_fit": 5,
      "claims": [
        {
          "id": "C1",
          "status": "intact",
          "evidence": "“星河零售于 2026 年 4 月在 12 家门店启动试点”"
        },
        {
          "id": "C2",
          "status": "intact",
          "evidence": "“顾客平均等待时间从 4 分钟缩短到 45 秒”"
        },
        {
          "id": "C3",
          "status": "intact",
          "evidence": "“转人工比例从 31% 降至 18%”"
        },
        {
          "id": "C4",
          "status": "intact",
          "evidence": "“满意度仍保持在 4.2/5，与上一季度持平”"
        },
        {
          "id": "C5",
          "status": "intact",
          "evidence": "“回答常见问题，接入订单查询系统，为售后问题添加标签”"
        },
        {
          "id": "C6",
          "status": "intact",
          "evidence": "“员工则可以少花时间处理这些事务，把精力留给更复杂、也更需要沟通温度的服务”"
        },
        {
          "id": "C7",
          "status": "intact",
          "evidence": "“方言识别和复杂退款，仍是目前最主要的挑战”"
        },
        {
          "id": "C8",
          "status": "intact",
          "evidence": "“公司计划先完成隐私评估，再在第四季度将系统扩展到 40 家门店”"
        }
      ],
      "added_claims": [
        {
          "claim": "系统所承担的部分具有标准化属性。",
          "evidence": "“它承担的是标准化、重复性的部分”"
        },
        {
          "claim": "转交给员工的服务更复杂。",
          "evidence": "“把精力留给更复杂、也更需要沟通温度的服务”"
        },
        {
          "claim": "试点是星河零售继续扩大应用范围的起点。",
          "evidence": "“也成为星河零售继续扩大应用范围的起点”"
        }
      ],
      "rationale": "行文成熟，数据、能力、限制和扩展条件均清楚准确。不过，“坚定决心”被弱化为“尝试新技术的态度”，效率与体验判断也增加了“至少从这组数据看”的限制；此外还加入了标准化、复杂度和持续扩围起点等原文未明说的判断。"
    },
    {
      "label": "C",
      "naturalness": 5,
      "reader_clarity": 5,
      "register_fit": 4,
      "claims": [
        {
          "id": "C1",
          "status": "intact",
          "evidence": "“星河零售于 2026 年 4 月在 12 家门店启动 AI 客服试点”"
        },
        {
          "id": "C2",
          "status": "intact",
          "evidence": "“顾客平均等待时间从 4 分钟降至 45 秒”"
        },
        {
          "id": "C3",
          "status": "intact",
          "evidence": "“转人工比例从 31% 降至 18%”"
        },
        {
          "id": "C4",
          "status": "intact",
          "evidence": "“满意度为 4.2/5，与上一季度持平”"
        },
        {
          "id": "C5",
          "status": "intact",
          "evidence": "“回答常见问题、接入订单查询系统，以及为售后问题添加标签”"
        },
        {
          "id": "C6",
          "status": "intact",
          "evidence": "“分担重复性事务，让员工把时间留给更需要沟通的工作”"
        },
        {
          "id": "C7",
          "status": "intact",
          "evidence": "“方言识别和复杂退款仍是试点中的主要难点”"
        },
        {
          "id": "C8",
          "status": "intact",
          "evidence": "“公司计划先完成隐私评估，再于第四季度将系统扩展到 40 家门店”"
        }
      ],
      "added_claims": [],
      "rationale": "核心事实全部保留，文字紧凑且没有明显新增内容。但删去了行业背景、数字化战略进入新阶段以及持续创新决心等原文判断，结尾也把“工具升级”和“智能化新起点”弱化成较含混的“关系到……推进”，因此不如更完整的版本。"
    },
    {
      "label": "D",
      "naturalness": 5,
      "reader_clarity": 5,
      "register_fit": 5,
      "claims": [
        {
          "id": "C1",
          "status": "intact",
          "evidence": "“星河零售于 2026 年 4 月在 12 家门店启动试点”"
        },
        {
          "id": "C2",
          "status": "intact",
          "evidence": "“顾客平均等待时间从 4 分钟缩短至 45 秒”"
        },
        {
          "id": "C3",
          "status": "intact",
          "evidence": "“转人工比例从 31% 降至 18%”"
        },
        {
          "id": "C4",
          "status": "intact",
          "evidence": "“满意度则保持在 4.2/5，与上一季度持平”"
        },
        {
          "id": "C5",
          "status": "intact",
          "evidence": "“回答常见问题、连接订单查询系统，以及为售后问题添加标签”"
        },
        {
          "id": "C6",
          "status": "intact",
          "evidence": "“并非简单替代人工，而是减少员工在重复事务上耗费的时间，让他们把精力放到更需要沟通和判断的服务环节”"
        },
        {
          "id": "C7",
          "status": "intact",
          "evidence": "“方言识别和复杂退款仍是主要挑战”"
        },
        {
          "id": "C8",
          "status": "intact",
          "evidence": "“计划先完成隐私评估，再于 Q4 将系统扩大到 40 家门店”"
        }
      ],
      "added_claims": [
        {
          "claim": "由员工重点处理的服务环节更需要判断。",
          "evidence": "“把精力放到更需要沟通和判断的服务环节”"
        }
      ],
      "rationale": "六个版本中对原文整体意义保留最完整：行业背景、战略判断、效率与体验关系、非替代人工的定位以及后续计划均在，语言也稳定清楚。小偏差是加入“需要判断”，并把智能化起点写成带未来意味的“将成为”。"
    },
    {
      "label": "E",
      "naturalness": 5,
      "reader_clarity": 5,
      "register_fit": 5,
      "claims": [
        {
          "id": "C1",
          "status": "intact",
          "evidence": "“星河零售于 2026 年 4 月在 12 家门店启动 AI 客服试点”"
        },
        {
          "id": "C2",
          "status": "intact",
          "evidence": "“顾客平均等待时间由 4 分钟缩短至 45 秒”"
        },
        {
          "id": "C3",
          "status": "intact",
          "evidence": "“转人工比例由 31% 降至 18%”"
        },
        {
          "id": "C4",
          "status": "intact",
          "evidence": "“满意度则维持在 4.2/5，与上一季度持平”"
        },
        {
          "id": "C5",
          "status": "intact",
          "evidence": "“回答常见问题、接入订单查询系统，以及为售后问题添加标签”"
        },
        {
          "id": "C6",
          "status": "intact",
          "evidence": "“并非单纯用机器替代人工，而是减少员工在重复性事务上的投入，让他们把更多精力放在需要沟通和判断的服务环节上”"
        },
        {
          "id": "C7",
          "status": "intact",
          "evidence": "“方言识别和复杂退款仍是主要挑战”"
        },
        {
          "id": "C8",
          "status": "intact",
          "evidence": "“公司计划先完成隐私评估，并于 Q4 将系统扩展至 40 家门店”"
        }
      ],
      "added_claims": [
        {
          "claim": "试点重点考察顾客体验和一线服务工作两个方面。",
          "evidence": "“重点观察其对顾客体验和一线服务工作的影响”"
        },
        {
          "claim": "需要员工处理的服务环节还需要判断。",
          "evidence": "“需要沟通和判断的服务环节”"
        }
      ],
      "rationale": "清楚自然，清单中的八项内容都在，其中“先完成”也保留了隐私评估在扩展之前的顺序。但它新增了未经原文说明的试点考察重点，同时删去了行业背景、数字化战略新阶段和创新决心，信息保存完整度较低。"
    },
    {
      "label": "F",
      "naturalness": 5,
      "reader_clarity": 5,
      "register_fit": 5,
      "claims": [
        {
          "id": "C1",
          "status": "intact",
          "evidence": "“星河零售已在 12 家门店启动 AI 客服试点。试点始于 2026 年 4 月”"
        },
        {
          "id": "C2",
          "status": "intact",
          "evidence": "“顾客平均等待时间由 4 分钟降至 45 秒”"
        },
        {
          "id": "C3",
          "status": "intact",
          "evidence": "“转人工比例从 31% 降到 18%”"
        },
        {
          "id": "C4",
          "status": "intact",
          "evidence": "“满意度仍为 4.2/5，与上一季度持平”"
        },
        {
          "id": "C5",
          "status": "intact",
          "evidence": "“回答常见问题、接入订单查询系统、给售后问题加标签”"
        },
        {
          "id": "C6",
          "status": "intact",
          "evidence": "“并不是把人工客服整体替换掉，而是把员工从重复咨询中解放出来，转去处理更需要沟通和判断的问题”"
        },
        {
          "id": "C7",
          "status": "intact",
          "evidence": "“方言识别和复杂退款仍是眼下的主要难点”"
        },
        {
          "id": "C8",
          "status": "intact",
          "evidence": "“公司计划先完成隐私评估，再于 Q4 把系统扩展到 40 家门店”"
        }
      ],
      "added_claims": [
        {
          "claim": "转由员工处理的问题更需要判断。",
          "evidence": "“转去处理更需要沟通和判断的问题”"
        }
      ],
      "rationale": "自然度很高，结构调整后依然清楚，全部清单事实和主要战略含义都得到保留。相较原文，“坚定决心”被弱化为“意愿”，“充分说明”也变成“至少从目前的数据看”；另加入了工作需要判断的描述。"
    }
  ],
  "ranking": [
    "D",
    "A",
    "F",
    "B",
    "C",
    "E"
  ],
  "best": "D",
  "confidence": "high",
  "limitations": "评价仅依据给定源文、清单和六个输出；未对文中事实作外部核验。"
}
