{
  "case_id": "04-zh-retail-analysis",
  "evaluations": [
    {
      "label": "A",
      "naturalness": 4,
      "reader_clarity": 5,
      "register_fit": 5,
      "claims": [
        {
          "id": "C1",
          "status": "intact",
          "evidence": "星河零售于 2026 年 4 月在 12 家门店启动试点"
        },
        {
          "id": "C2",
          "status": "intact",
          "evidence": "顾客平均等待时间从 4 分钟缩短至 45 秒"
        },
        {
          "id": "C3",
          "status": "intact",
          "evidence": "转人工比例从 31% 降至 18%"
        },
        {
          "id": "C4",
          "status": "intact",
          "evidence": "满意度则保持在 4.2/5，与上一季度持平"
        },
        {
          "id": "C5",
          "status": "intact",
          "evidence": "自动回答常见问题、接入订单查询系统，以及为售后问题添加标签"
        },
        {
          "id": "C6",
          "status": "intact",
          "evidence": "员工可以少做重复劳动，把更多精力放在需要沟通和判断的服务上"
        },
        {
          "id": "C7",
          "status": "intact",
          "evidence": "方言识别和复杂退款仍是主要挑战"
        },
        {
          "id": "C8",
          "status": "intact",
          "evidence": "公司计划先完成隐私评估，再于 Q4 将系统扩大到 40 家门店"
        }
      ],
      "added_claims": [],
      "rationale": "八条事实全部保留，且是六篇中唯一保留『自动』限定的；行业背景与『数字化战略新阶段／创新决心』均在。两处判断强度有轻微偏移：原文一般性模态判断『效率提升并不必然以体验为代价』被改成针对本次数据的确定表述『效率提高并没有牺牲服务体验』；结尾递进『不只是…更是』被拉平为『既是…也是』。行文自然，开头『随着…』略带模板感但可读。无硬新增。"
    },
    {
      "label": "B",
      "naturalness": 5,
      "reader_clarity": 5,
      "register_fit": 5,
      "claims": [
        {
          "id": "C1",
          "status": "intact",
          "evidence": "星河零售于 2026 年 4 月在 12 家门店启动 AI 客服试点"
        },
        {
          "id": "C2",
          "status": "intact",
          "evidence": "顾客平均等待时间由 4 分钟缩短至 45 秒"
        },
        {
          "id": "C3",
          "status": "intact",
          "evidence": "转人工比例由 31% 降至 18%"
        },
        {
          "id": "C4",
          "status": "intact",
          "evidence": "满意度则维持在 4.2/5，与上一季度持平"
        },
        {
          "id": "C5",
          "status": "intact",
          "evidence": "回答常见问题、接入订单查询系统，以及为售后问题添加标签（三项齐全，『自动』由主语『这套系统』隐含）"
        },
        {
          "id": "C6",
          "status": "intact",
          "evidence": "并非单纯用机器替代人工，而是减少员工在重复性事务上的投入"
        },
        {
          "id": "C7",
          "status": "intact",
          "evidence": "方言识别和复杂退款仍是主要挑战"
        },
        {
          "id": "C8",
          "status": "intact",
          "evidence": "公司计划先完成隐私评估，并于 Q4 将系统扩展至 40 家门店"
        }
      ],
      "added_claims": [
        {
          "claim": "试点的目的在于重点观察对顾客体验和一线服务工作的影响（原文未作此目的陈述）",
          "evidence": "重点观察其对顾客体验和一线服务工作的影响"
        }
      ],
      "rationale": "八条清单事实完整，且保留了『并非单纯用机器替代人工』这一关键限定判断。但删去了原文首段两层信息：行业趋势判断（AI 客服成为重要抓手）和战略意义（数字化战略新阶段／创新决心），并用一句原文没有的『重点观察…影响』替代，属软性新增框架。文字本身是六篇中最简练自然的之一，但意义保存层有实际损失。"
    },
    {
      "label": "C",
      "naturalness": 5,
      "reader_clarity": 5,
      "register_fit": 5,
      "claims": [
        {
          "id": "C1",
          "status": "intact",
          "evidence": "星河零售于 2026 年 4 月在 12 家门店启动 AI 客服试点"
        },
        {
          "id": "C2",
          "status": "intact",
          "evidence": "顾客平均等待时间从 4 分钟降至 45 秒"
        },
        {
          "id": "C3",
          "status": "intact",
          "evidence": "转人工比例从 31% 降至 18%"
        },
        {
          "id": "C4",
          "status": "intact",
          "evidence": "满意度为 4.2/5，与上一季度持平"
        },
        {
          "id": "C5",
          "status": "intact",
          "evidence": "回答常见问题、接入订单查询系统，以及为售后问题添加标签（三项齐全，『自动』由主语隐含）"
        },
        {
          "id": "C6",
          "status": "intact",
          "evidence": "分担重复性事务，让员工把时间留给更需要沟通的工作"
        },
        {
          "id": "C7",
          "status": "intact",
          "evidence": "方言识别和复杂退款仍是试点中的主要难点"
        },
        {
          "id": "C8",
          "status": "intact",
          "evidence": "公司计划先完成隐私评估，再于第四季度将系统扩展到 40 家门店"
        }
      ],
      "added_claims": [],
      "rationale": "八条事实齐全、无新增，但信息删减在六篇中最多：删去行业趋势段、删去『数字化战略新阶段／创新决心』，且未保留『不是简单替代人工』的限定判断（仅写『分担重复性事务』）。文字干净自然、清晰度高，但作为『保持全部信息』的改写，意义保存门槛上弱于 A/D/E/F，也略弱于保留限定判断的 B。"
    },
    {
      "label": "D",
      "naturalness": 4,
      "reader_clarity": 5,
      "register_fit": 5,
      "claims": [
        {
          "id": "C1",
          "status": "intact",
          "evidence": "星河零售于 2026 年 4 月在 12 家门店启动试点"
        },
        {
          "id": "C2",
          "status": "intact",
          "evidence": "顾客平均等待时间从 4 分钟缩短到 45 秒"
        },
        {
          "id": "C3",
          "status": "intact",
          "evidence": "转人工比例从 31% 降至 18%"
        },
        {
          "id": "C4",
          "status": "intact",
          "evidence": "满意度仍保持在 4.2/5，与上一季度持平"
        },
        {
          "id": "C5",
          "status": "intact",
          "evidence": "回答常见问题，接入订单查询系统，为售后问题添加标签（三项齐全，『自动』由主语隐含）"
        },
        {
          "id": "C6",
          "status": "intact",
          "evidence": "它承担的是标准化、重复性的部分……把精力留给更复杂、也更需要沟通温度的服务"
        },
        {
          "id": "C7",
          "status": "intact",
          "evidence": "方言识别和复杂退款，仍是目前最主要的挑战"
        },
        {
          "id": "C8",
          "status": "intact",
          "evidence": "公司计划先完成隐私评估，再在第四季度将系统扩展到 40 家门店"
        }
      ],
      "added_claims": [],
      "rationale": "八条事实完整，行业背景、战略意义、结尾递进判断均保留，结构最贴近原文。『坚定决心／拥抱创新』被弱化为『持续尝试新技术的态度』，判断强度略降；『至少从这组数据看』的限定反而更严谨；结尾『继续扩大应用范围的起点』可由扩店计划推出，不算硬新增。行文成熟，唯开头『在…的今天』残留套话，篇幅略长。"
    },
    {
      "label": "E",
      "naturalness": 4,
      "reader_clarity": 5,
      "register_fit": 5,
      "claims": [
        {
          "id": "C1",
          "status": "intact",
          "evidence": "星河零售于 2026 年 4 月在 12 家门店启动试点"
        },
        {
          "id": "C2",
          "status": "intact",
          "evidence": "顾客平均等待时间从 4 分钟缩短至 45 秒"
        },
        {
          "id": "C3",
          "status": "intact",
          "evidence": "转人工比例从 31% 降至 18%"
        },
        {
          "id": "C4",
          "status": "intact",
          "evidence": "满意度则保持在 4.2/5，与上一季度持平"
        },
        {
          "id": "C5",
          "status": "intact",
          "evidence": "回答常见问题、连接订单查询系统，以及为售后问题添加标签（三项齐全，『自动』由主语隐含）"
        },
        {
          "id": "C6",
          "status": "intact",
          "evidence": "并非简单替代人工，而是减少员工在重复事务上耗费的时间，让他们把精力放到更需要沟通和判断的服务环节"
        },
        {
          "id": "C7",
          "status": "intact",
          "evidence": "方言识别和复杂退款仍是主要挑战"
        },
        {
          "id": "C8",
          "status": "intact",
          "evidence": "星河零售计划先完成隐私评估，再于 Q4 将系统扩大到 40 家门店"
        }
      ],
      "added_claims": [],
      "rationale": "八条事实完整且信息零损失：行业趋势、战略意义、结尾递进全部保留。判断强度保存最好——『效率提高并不必然以牺牲服务体验为代价』完整保留原文模态限定，『并非简单替代人工』『持续推进创新的决心』『不仅…也将』的强度均与原文一致。开头『随着零售行业持续变化』略带模板感，是仅存的瑕疵。"
    },
    {
      "label": "F",
      "naturalness": 5,
      "reader_clarity": 5,
      "register_fit": 5,
      "claims": [
        {
          "id": "C1",
          "status": "intact",
          "evidence": "星河零售已在 12 家门店启动 AI 客服试点。试点始于 2026 年 4 月"
        },
        {
          "id": "C2",
          "status": "intact",
          "evidence": "顾客平均等待时间由 4 分钟降至 45 秒"
        },
        {
          "id": "C3",
          "status": "intact",
          "evidence": "转人工比例从 31% 降到 18%"
        },
        {
          "id": "C4",
          "status": "intact",
          "evidence": "满意度仍为 4.2/5，与上一季度持平"
        },
        {
          "id": "C5",
          "status": "intact",
          "evidence": "回答常见问题、接入订单查询系统、给售后问题加标签（三项齐全）"
        },
        {
          "id": "C6",
          "status": "intact",
          "evidence": "并不是把人工客服整体替换掉，而是把员工从重复咨询中解放出来，转去处理更需要沟通和判断的问题"
        },
        {
          "id": "C7",
          "status": "intact",
          "evidence": "方言识别和复杂退款仍是眼下的主要难点"
        },
        {
          "id": "C8",
          "status": "intact",
          "evidence": "公司计划先完成隐私评估，再于 Q4 把系统扩展到 40 家门店"
        }
      ],
      "added_claims": [],
      "rationale": "八条事实完整，结构调整（战略意义移至第三段）不影响事实，保留了『数字化战略新阶段／推进创新的意愿』，但删去了原文的行业趋势句。『重复劳动』被窄化为『重复咨询』，属轻微收窄；语气略口语（『做三件事』『加标签』『把系统扩展到』），仍在行业分析语域内，行文流畅自然。意义保存完整度低于 A/D/E。"
    }
  ],
  "ranking": [
    "E",
    "A",
    "D",
    "F",
    "B",
    "C"
  ],
  "best": "E",
  "confidence": "high",
  "limitations": "八条清单事实在六篇中均判定为 intact，排序主要取决于清单外信息（行业趋势句、战略意义句、『不是简单替代人工』限定判断）的保留程度与判断强度的细微偏移，这部分依赖评估者对『保持全部信息』的解释空间。C5 中『自动』限定在 B/C/D/E/F 中均由主语『这套系统』隐含承接，未判为 altered；若采用更严格的限定词标准，这五篇的 C5 可改判轻微 altered，但不影响相对排序。"
}
