{
  "case_id": "04-zh-retail-analysis",
  "evaluations": [
    {
      "label": "A",
      "naturalness": 5,
      "reader_clarity": 5,
      "register_fit": 5,
      "claims": [
        {
          "id": "C1",
          "status": "intact",
          "evidence": "星河零售于 2026 年 4 月在 12 家门店启动试点。"
        },
        {
          "id": "C2",
          "status": "intact",
          "evidence": "顾客平均等待时间从 4 分钟缩短到 45 秒"
        },
        {
          "id": "C3",
          "status": "intact",
          "evidence": "转人工比例从 31% 降至 18%"
        },
        {
          "id": "C4",
          "status": "intact",
          "evidence": "满意度仍保持在 4.2/5，与上一季度持平"
        },
        {
          "id": "C5",
          "status": "altered",
          "evidence": "这套系统主要处理三类工作：回答常见问题，接入订单查询系统，为售后问题添加标签。"
        },
        {
          "id": "C6",
          "status": "intact",
          "evidence": "员工则可以少花时间处理这些事务，把精力留给更复杂、也更需要沟通温度的服务。"
        },
        {
          "id": "C7",
          "status": "altered",
          "evidence": "方言识别和复杂退款，仍是目前最主要的挑战。"
        },
        {
          "id": "C8",
          "status": "intact",
          "evidence": "公司计划先完成隐私评估，再在第四季度将系统扩展到 40 家门店。"
        }
      ],
      "added_claims": [
        {
          "claim": "试点成为星河零售继续扩大应用范围的起点。",
          "evidence": "也成为星河零售继续扩大应用范围的起点。"
        }
      ],
      "rationale": "语言成熟、结构顺畅，行业分析语域稳定。但 C5 未明确保留“自动”这一限定，C7 将“主要挑战”强化为“最主要的挑战”，并新增“继续扩大应用范围的起点”的判断，因此意义保真度低于更克制的版本。"
    },
    {
      "label": "B",
      "naturalness": 4,
      "reader_clarity": 5,
      "register_fit": 4,
      "claims": [
        {
          "id": "C1",
          "status": "intact",
          "evidence": "星河零售于 2026 年 4 月在 12 家门店启动 AI 客服试点。"
        },
        {
          "id": "C2",
          "status": "intact",
          "evidence": "顾客平均等待时间从 4 分钟降至 45 秒"
        },
        {
          "id": "C3",
          "status": "intact",
          "evidence": "转人工比例从 31% 降至 18%"
        },
        {
          "id": "C4",
          "status": "intact",
          "evidence": "满意度为 4.2/5，与上一季度持平"
        },
        {
          "id": "C5",
          "status": "altered",
          "evidence": "系统目前处理三类工作：回答常见问题、接入订单查询系统，以及为售后问题添加标签。"
        },
        {
          "id": "C6",
          "status": "intact",
          "evidence": "它的作用是分担重复性事务，让员工把时间留给更需要沟通的工作。"
        },
        {
          "id": "C7",
          "status": "intact",
          "evidence": "方言识别和复杂退款仍是试点中的主要难点。"
        },
        {
          "id": "C8",
          "status": "intact",
          "evidence": "公司计划先完成隐私评估，再于第四季度将系统扩展到 40 家门店。"
        }
      ],
      "added_claims": [],
      "rationale": "简洁明了，关键数值、挑战和扩展条件都清楚，读者负担低。但省略了原文的行业背景与数字化战略等框架信息，且 C5 未明确保留“自动”，整体保真度略受影响。"
    },
    {
      "label": "C",
      "naturalness": 4,
      "reader_clarity": 5,
      "register_fit": 4,
      "claims": [
        {
          "id": "C1",
          "status": "intact",
          "evidence": "星河零售于 2026 年 4 月在 12 家门店启动 AI 客服试点"
        },
        {
          "id": "C2",
          "status": "intact",
          "evidence": "顾客平均等待时间由 4 分钟缩短至 45 秒"
        },
        {
          "id": "C3",
          "status": "intact",
          "evidence": "转人工比例由 31% 降至 18%"
        },
        {
          "id": "C4",
          "status": "intact",
          "evidence": "满意度则维持在 4.2/5，与上一季度持平"
        },
        {
          "id": "C5",
          "status": "altered",
          "evidence": "这套系统目前主要承担三项工作：回答常见问题、接入订单查询系统，以及为售后问题添加标签。"
        },
        {
          "id": "C6",
          "status": "intact",
          "evidence": "减少员工在重复性事务上的投入，让他们把更多精力放在需要沟通和判断的服务环节上。"
        },
        {
          "id": "C7",
          "status": "intact",
          "evidence": "方言识别和复杂退款仍是主要挑战。"
        },
        {
          "id": "C8",
          "status": "intact",
          "evidence": "公司计划先完成隐私评估，并于 Q4 将系统扩展至 40 家门店。"
        }
      ],
      "added_claims": [
        {
          "claim": "试点重点观察其对顾客体验和一线服务工作的影响。",
          "evidence": "重点观察其对顾客体验和一线服务工作的影响。"
        }
      ],
      "rationale": "表达清晰、语气平稳，核心数据与条件关系基本可读。但开头加入“重点观察其对顾客体验和一线服务工作的影响”这一原文未提供的试点目的，且 C5 未明确“自动”，意义保真度下降。"
    },
    {
      "label": "D",
      "naturalness": 5,
      "reader_clarity": 5,
      "register_fit": 5,
      "claims": [
        {
          "id": "C1",
          "status": "intact",
          "evidence": "星河零售于 2026 年 4 月在 12 家门店启动试点"
        },
        {
          "id": "C2",
          "status": "intact",
          "evidence": "顾客平均等待时间从 4 分钟缩短至 45 秒"
        },
        {
          "id": "C3",
          "status": "intact",
          "evidence": "转人工比例从 31% 降至 18%"
        },
        {
          "id": "C4",
          "status": "intact",
          "evidence": "满意度则保持在 4.2/5，与上一季度持平"
        },
        {
          "id": "C5",
          "status": "altered",
          "evidence": "这套系统目前承担三项工作：回答常见问题、连接订单查询系统，以及为售后问题添加标签。"
        },
        {
          "id": "C6",
          "status": "intact",
          "evidence": "减少员工在重复事务上耗费的时间，让他们把精力放到更需要沟通和判断的服务环节。"
        },
        {
          "id": "C7",
          "status": "intact",
          "evidence": "方言识别和复杂退款仍是主要挑战。"
        },
        {
          "id": "C8",
          "status": "intact",
          "evidence": "星河零售计划先完成隐私评估，再于 Q4 将系统扩大到 40 家门店。"
        }
      ],
      "added_claims": [],
      "rationale": "整体最接近原文的行业分析口径，保留了行业背景、数字化战略和谨慎结论，语域成熟。主要扣分点是 C5 未明确保留“自动”这一限定，因此仍逊于 E。"
    },
    {
      "label": "E",
      "naturalness": 5,
      "reader_clarity": 5,
      "register_fit": 5,
      "claims": [
        {
          "id": "C1",
          "status": "intact",
          "evidence": "星河零售于 2026 年 4 月在 12 家门店启动试点"
        },
        {
          "id": "C2",
          "status": "intact",
          "evidence": "顾客平均等待时间从 4 分钟缩短至 45 秒"
        },
        {
          "id": "C3",
          "status": "intact",
          "evidence": "转人工比例从 31% 降至 18%"
        },
        {
          "id": "C4",
          "status": "intact",
          "evidence": "满意度则保持在 4.2/5，与上一季度持平"
        },
        {
          "id": "C5",
          "status": "intact",
          "evidence": "系统主要承担三项工作：自动回答常见问题、接入订单查询系统，以及为售后问题添加标签。"
        },
        {
          "id": "C6",
          "status": "intact",
          "evidence": "员工可以少做重复劳动，把更多精力放在需要沟通和判断的服务上。"
        },
        {
          "id": "C7",
          "status": "intact",
          "evidence": "方言识别和复杂退款仍是主要挑战。"
        },
        {
          "id": "C8",
          "status": "intact",
          "evidence": "公司计划先完成隐私评估，再于 Q4 将系统扩大到 40 家门店。"
        }
      ],
      "added_claims": [],
      "rationale": "事实链完整，三项能力中明确保留“自动”，数值、挑战、条件和扩展计划均准确。行文自然，信息密度与行业分析语域匹配，是保真度最高的版本。"
    },
    {
      "label": "F",
      "naturalness": 5,
      "reader_clarity": 5,
      "register_fit": 5,
      "claims": [
        {
          "id": "C1",
          "status": "intact",
          "evidence": "星河零售已在 12 家门店启动 AI 客服试点。试点始于 2026 年 4 月"
        },
        {
          "id": "C2",
          "status": "intact",
          "evidence": "顾客平均等待时间由 4 分钟降至 45 秒"
        },
        {
          "id": "C3",
          "status": "intact",
          "evidence": "转人工比例从 31% 降到 18%"
        },
        {
          "id": "C4",
          "status": "intact",
          "evidence": "满意度仍为 4.2/5，与上一季度持平"
        },
        {
          "id": "C5",
          "status": "altered",
          "evidence": "这套系统主要做三件事：回答常见问题、接入订单查询系统、给售后问题加标签。"
        },
        {
          "id": "C6",
          "status": "intact",
          "evidence": "把员工从重复咨询中解放出来，转去处理更需要沟通和判断的问题。"
        },
        {
          "id": "C7",
          "status": "intact",
          "evidence": "方言识别和复杂退款仍是眼下的主要难点。"
        },
        {
          "id": "C8",
          "status": "intact",
          "evidence": "公司计划先完成隐私评估，再于 Q4 把系统扩展到 40 家门店。"
        }
      ],
      "added_claims": [],
      "rationale": "行文自然，关键事实准确，条件顺序清楚，读起来像成熟的简短分析。但省略了原文的行业背景铺垫，且 C5 未明确“自动”，因此排在 E 和 D 之后。"
    }
  ],
  "ranking": [
    "E",
    "D",
    "F",
    "B",
    "A",
    "C"
  ],
  "best": "E",
  "confidence": "medium",
  "limitations": "本次评估将 C5 中的“自动”视为需要显性保留的限定；未列入清单的修辞性增删主要在排序和理由中考虑，未全部单列为新增主张。"
}
